{"role": "code-reviewer", "gate": "PASS", "counts": {"critical": 0, "major": 0, "minor": 2}, "summary": "All 5 ACs pass. cargo build succeeds; stores agents list prints 5 entries; cargo test cli::agents passes (5 tests); flat layout confirmed via agent_path() returning <base>/<name>.md; BUNDLED_AGENTS.len() == 5 asserted. Two minor style findings documented in details.", "details": "[MINOR] doc-comment on agent_path() is thin — consider expanding to note the flat layout rationale explicitly.\n[MINOR] uninstall_removes_file test replaces the full uninstall_one() logic inline rather than calling it; acceptable but diverges slightly from the skills test pattern which also replicated the logic inline."}
